task_id,category,difficulty,condition,trial,correctness,completeness,quality,verification,latency_seconds,execution_cost_usd,judge_cost_usd,total_cost_usd,subtask_count,reassignments,reasoning
R1,research,easy,naive,1,10,10,9,PASS,7.2,0.004182,0.004245,0.008427,1,0,"The output is factually accurate, correctly identifying DeepMind as the developer and providing both 2018 (AlphaFold 1) and 2020 (AlphaFold 2) release dates. It goes beyond the basic question to provide comprehensive context including CASP competitions, the 2021 database release, and the scientific significance. The information is well-structured with clear formatting, bullet points, and credible sources. It fully meets the acceptance criteria by containing both 'DeepMind' and the required years. The only minor improvement could be slightly more concise presentation, but the additional context adds significant value."
R1,research,easy,delegato,1,10,10,9,PASS,7.65,0.004182,0.004245,0.008427,1,0,"The output is factually accurate, correctly identifying DeepMind as the developer and providing both 2018 (AlphaFold 1) and 2020 (AlphaFold 2) release dates. It goes beyond the basic question to provide comprehensive context including CASP competitions, the 2021 database release, and the scientific significance. The information is well-structured with clear formatting, bullet points, and credible sources. It fully meets the acceptance criteria by containing both 'DeepMind' and the required years. The only minor improvement could be slightly more concise presentation, but the additional context adds significant value."
R4,research,medium,naive,1,9,9,9,PASS,20.36,0.013959,0.007773,0.021732,1,0,"The output demonstrates high correctness with accurate technical information about quantum computing approaches, specific qubit counts (IBM Condor 1,121 qubits, IBM Heron 133 qubits, Google Sycamore 70 qubits, IonQ 32 qubits, Atom Computing 1,000+ qubits), and realistic timelines. It's highly complete, covering 5 companies across 4 different technological approaches (superconducting, trapped ion, neutral atom, photonic) which exceeds the minimum requirement of 3 companies. The content addresses current capabilities, technical challenges, and future outlook comprehensively. The quality is excellent with clear structure, professional presentation, logical flow from company-specific details to broader industry analysis, and appropriate technical depth. It fully meets verification criteria by covering 5+ companies with specifically named approaches, including concrete qubit counts and milestones, and maintaining technical accuracy throughout. Minor deduction in correctness due to some approximate figures and the rapidly evolving nature of the field, but overall this is a comprehensive, accurate, and well-structured summary."
R4,research,medium,delegato,1,9,10,9,PASS,23.67,0.018726,0.007119,0.025845,1,0,"The output demonstrates high correctness with accurate technical information about quantum computing approaches, specific qubit counts (IBM Condor 1,121 qubits, IBM Heron 133 qubits, Google Sycamore 70 qubits, IonQ 32 qubits), and proper technical terminology. It achieves full completeness by covering 6+ companies (IBM, Google, IonQ, Atom Computing, Xanadu, Quantinuum) with their specific approaches (superconducting, trapped ion, photonic, neutral atoms). The quality is excellent with clear structure, professional presentation, and logical flow from individual companies to broader market analysis. It fully meets verification criteria by covering 3+ companies with named approaches, including specific qubit counts and milestones, and maintaining technical accuracy throughout. Minor deduction in correctness due to some information being slightly dated (Google's current systems may have evolved beyond the 70-qubit specification mentioned)."
C1,coding,easy,naive,1,10,10,9,PASS,6.5,0.000264,0.005499,0.005763,1,0,"The function is logically sound and correctly implements the algorithm by converting to a set to remove duplicates, checking for sufficient unique values, sorting in descending order, and returning the second element. It addresses all parts of the task including edge case handling. The code is well-structured with clear documentation, meaningful variable names, and helpful comments. Testing against the acceptance criteria: [1,2,3,4,5] returns 4 ✓, [5,5,4,3] returns 4 ✓, [1] returns None ✓, [] returns None ✓, [3,3,3] returns None ✓. All test cases pass. The only minor improvement could be slightly more concise variable naming, but overall this is an excellent solution."
C1,coding,easy,delegato,1,10,10,9,PASS,7.03,0.000282,0.005592,0.005874,1,0,"The function is logically sound and correctly implements the algorithm by converting to a set to remove duplicates, checking for sufficient unique values, sorting in descending order, and returning the second element. It addresses all parts of the task including edge case handling. The code is well-structured with clear documentation, meaningful variable names, and helpful comments. Testing against the acceptance criteria: [1,2,3,4,5] returns 4 ✓, [5,5,4,3] returns 4 ✓, [1] returns None ✓, [] returns None ✓, [3,3,3] returns None ✓. All test cases pass. The only minor improvement could be slightly more concise variable naming, but overall this is an excellent solution."
C4,coding,medium,naive,1,9,10,9,PASS,11.92,0.000508,0.007128,0.007637,1,0,"The code correctly implements all required functionality. It imports httpx as specified, includes both GET and POST methods, and implements proper retry logic with exponential backoff (2^attempt with 30s cap) and timeout handling. The exponential backoff formula is mathematically sound, starting at 1s, then 2s, 4s, 8s, etc. The code handles both httpx.RequestError and HTTPStatusError appropriately. Minor deduction in correctness because the backoff calculation could be more explicit about the initial delay, and in quality because some docstring formatting could be improved. The code is well-structured, includes comprehensive documentation, proper error handling, and follows Python best practices. All acceptance criteria are met: httpx is imported, get/post methods are present, and the retry/backoff logic is correctly implemented."
C4,coding,medium,delegato,1,8,9,8,PASS,14.71,0.00767,0.006702,0.014371,1,0,"The code correctly implements the required functionality with proper httpx import, GET/POST methods, retry logic with exponential backoff, and timeout handling. The exponential backoff formula (2^attempt) is mathematically correct and includes a reasonable cap. However, there are minor issues: the code doesn't handle all HTTP status codes that should trigger retries (only handles RequestError and HTTPStatusError), and it could benefit from more robust error handling for non-JSON responses. The code is well-structured with clear documentation, proper type hints, and follows Python best practices. All acceptance criteria are met: httpx is imported, both get/post methods are present, and the retry/backoff logic is implemented correctly."
A1,analysis,easy,naive,1,9,8,8,FAIL,12.25,0.000452,0.006165,0.006617,1,0,"The output is factually accurate and provides sound technical insights about both architectures. However, it fails the verification criteria because it doesn't provide the required JSON format with pros and cons arrays of exactly 5 items each. Instead, it provides a comprehensive text analysis with pros and cons for both microservices AND monolithic architectures (20 total points instead of the requested 10). While the content is excellent and highly relevant to the startup context, mentioning team size constraints and resource limitations throughout, it doesn't meet the specific structural requirements. The completeness score is reduced because it doesn't directly compare the two architectures as requested, but rather lists pros/cons for each separately. The quality is high with clear structure and professional presentation, but the format doesn't match requirements."
A1,analysis,easy,delegato,1,9,10,9,FAIL,10.25,0.007173,0.004713,0.011886,1,0,"The output is highly accurate with well-researched pros and cons that are factually sound and logically presented. It completely addresses the task by providing exactly 5 pros and 5 cons specifically contextualized for a 5-engineer startup. The content is well-structured with clear headings, detailed explanations, and professional presentation. However, it fails the verification criteria because the output is in markdown format rather than the required JSON format with 'pros' and 'cons' arrays of length 5 each. Despite the high quality content, the format requirement was not met."
A4,analysis,medium,naive,1,8,9,8,PASS,9.83,0.000376,0.005526,0.005902,1,0,"The output correctly identifies all four SWOT quadrants and names the specified real competitors (GitHub Copilot, CodeRabbit, Sourcery). It identifies specific technical barriers including dependency on high-quality training data, computational resource requirements, and the need for extensive AI model development. The analysis is grounded in realistic market considerations rather than generic business advice. The reasoning addresses market trends like remote work, growing demand for code quality, and regulatory compliance. Minor deductions for correctness due to some generalizations that could be more specific to the AI code review domain, and slight quality reduction as some points could be more detailed or better supported with market-specific insights."
A4,analysis,medium,delegato,1,9,9,9,PASS,40.58,0.026694,0.009219,0.035913,1,0,"The output demonstrates strong performance across all dimensions. CORRECTNESS (9/10): The analysis is factually grounded with realistic market projections, accurate competitor identification, and logical reasoning throughout. Technical barriers like model hallucination, IP concerns, and integration complexity are accurately identified. COMPLETENESS (9/10): All four SWOT quadrants are thoroughly covered, real competitors are named (GitHub Copilot, CodeRabbit, Sourcery mentioned in context), and specific technical barriers are identified (security concerns, accuracy expectations, integration complexity, model hallucination). The analysis addresses market trends, competitive landscape, and provides strategic recommendations. QUALITY (9/10): The output is exceptionally well-structured with clear headings, bullet points, and logical flow. Professional tone throughout with specific data points and strategic insights. Includes sources and disclaimers. VERIFICATION (PASS): Meets all acceptance criteria - contains all 4 SWOT quadrants, names real competitors, identifies specific technical barriers (AI model training costs, integration complexity, security concerns, model hallucination), and reasoning is grounded in market realities rather than generic business advice. Minor deduction in correctness due to some projections being speculative, but overall excellent analysis."
W1,writing,easy,naive,1,10,10,9,PASS,3.98,0.002571,0.003876,0.006447,1,0,"The output is factually accurate and logically structured as a professional email declining a meeting. It addresses all task requirements: declining the invitation, explaining the scheduling conflict, and providing 3 alternative time slots. The email is well-structured with appropriate salutation, body, and closing. The tone is professional and courteous throughout. Word count is approximately 85 words, meeting the <100 word requirement. All 3 time slots are clearly listed with specific days and times. The only minor consideration is the use of placeholder brackets [Name], [Date], [Your Name] which is actually appropriate for a template format."
W1,writing,easy,delegato,1,10,10,9,PASS,3.91,0.002571,0.003876,0.006447,1,0,"The output is factually accurate and logically structured as a professional email declining a meeting. It addresses all task requirements: declining the invitation, explaining the scheduling conflict, and providing 3 alternative time slots. The email is well-structured with appropriate salutation, body, and closing. The tone is professional and courteous throughout. Word count is approximately 85 words, meeting the <100 word requirement. All 3 time slots are clearly listed with specific days and times. The only minor consideration is the use of placeholder brackets [Name], [Date], [Your Name] which is actually appropriate for a template format."
W4,writing,medium,naive,1,9,10,9,PASS,15.45,0.008874,0.005646,0.01452,1,0,"The output demonstrates high correctness with factually accurate information about open-source LLMs, API pricing models, and technical considerations. All claims are logically sound and well-supported. Completeness is excellent - it includes a clear introduction, exactly 3 distinct main arguments (cost control, data privacy, technical independence), each with specific supporting points, and a strong conclusion. The quality is very high with professional writing, clear structure, and engaging content. The verification passes all criteria: word count is approximately 420 words (within 350-450 range), has clear intro/body/conclusion structure, presents 3 distinct arguments, and each argument is supported with specific reasoning rather than generic statements. The arguments are well-differentiated and provide concrete examples and implications for startups."
W4,writing,medium,delegato,1,9,10,9,PASS,19.68,0.013446,0.005814,0.01926,1,0,"The output demonstrates high correctness with factually accurate information about open-source LLMs (Llama 2, Mistral, Code Llama) and realistic cost/scaling scenarios. It achieves perfect completeness by including all required elements: clear introduction, three distinct arguments (cost control, data privacy, technical independence) with specific supporting points, and a strong conclusion. The quality is excellent with professional structure, clear headings, and logical flow. The verification passes all criteria: word count is approximately 420 words (within 350-450 range), has clear intro/body/conclusion structure, presents 3 distinct arguments, and provides specific reasoning rather than generic statements. Each argument includes concrete examples like 'viral feature causing API bill spikes' and 'fine-tuning on domain data for competitive advantage.'"
